url,type,price,gouvernorat,delegation,surface_totale,nombre_chambres,nombre_salle_bain,description,etage,neuf,haut_standing,parking,piscine,vue_panoramique,jardin,climatisation,chauffage,ascenseur,balcon,terrasse,area
https://www.mubawab.tn/fr/a/8222190/a-vendre-villa-de-764-m%C2%B2-chotrana-3,0,990000,la soukra,chotrana 3,560,6,7,"Cette villa est érigée sur deux niveaux dont l’étage est réparti en deux appartements avec deux entrées totalement indépendante idéal pour une grande famille ou un investissement locatif.Elle offre un cadre de vie agréable et fort potentiel d’aménagement. Elle est située dans un quartier recherché, cette propriété se distingue par sa conception pratique et évolutive.A l’extérieure, la villa dispose d’un terrain permettant la réalisation d’une piscine, ainsi qu’un jardin qui peut être aménagé selon vos envies.Le salon, d’une générosité remarquable, déduit par ses volumes ouverts, sa luminosité exceptionnelle et son atmosphère raffinée, offrant un espace de vie à la fois élégant et fonctionnel.La cuisine est totalement aménagée et équipée par un coin repas annexée par un séchoir qui donne axé su jardin pour plus de fonctionnalité.La partie jour est complété par une chambre d’ami et une salle d’eau pour les invités.La partie nuit loge deux suites parentales et une chambre à coucher qui se partage une salle de bain.L’étage abrite deux appartements en S2 dont un habitable de suite et le deuxième nécessite quelques travaux d’embellissement. Ils sont similaire de conception offrant autonomie et intimité, balcon pour profiter des beaux jours.Un garage de 20 m² fermé pouvant accueillir deux voitures, elle dispose d’un espace à l’extérieur offrant la possibilité de stationner deux autres voitures en toutes sécurités.Toutes les pièces sont équipées par des climatisations en split système et chauffage central.",0,0,0,0,1,0,1,1,1,0,1,1,Non spécifié
https://www.mubawab.tn/fr/a/8255033/a-vendre-maison-%C3%A0-bouhsina,0,520000,sousse jaouhara,Non spécifié,380,3,1,"À VENDRE : Maison RDC fonctionnelle et spacieuseEmplacement : Située dans un quartier calme et résidentiel, à proximité des commodités essentielles (écoles, commerces, transports).Composition :Deux Salons : Accueillant, avec un espace ouvert ou classique2 à 4 chambres : Spacieuses et lumineuses, idéales pour une familleCuisine : Moderne et bien équipéeSalle de bain : Pratique et bien agencéeEspace extérieur : Terrasse, jardinCaractéristiques supplémentaires :Bonne orientation offrant un éclairage naturelPossibilité d’agrandissement ou de rénovationAccès facile et garage disponiblePrix attractif : 520.000 DTDisponibilité immédiatePour toute information complémentaire ou visite n’hésitez pas à nous contacter par téléphone:216 51 019 242Contactez-nous aussi par WhatsApp : 216 51 019 242Par email : contact@ighimmo.com",0,0,0,0,0,0,1,0,0,0,0,1,Non spécifié
https://www.mubawab.tn/fr/a/8002469/villa-victor-hugo-%C3%A0-vendre-%C3%A0-mornag,0,800000,mornag,mornag,500,6,2,"Une coquette villa avec piscine sur un terrain de 500m² située dans un quartier résidentiel à Cité Chikh, Mornag. Au RDC, On trouve un double salon, un séjour, une cuisine, 3 chambres et une salle d'eau pour les invités. A L'étage, On a 3 chambres et une salle de bain. A L'extérieur, On a une terrasse, un jardin, un garage et un abris pour 4 voitures. Pour tous les renseignements, contacter l'agent .",0,0,0,0,1,0,1,0,0,0,0,1,Non spécifié
https://www.mubawab.tn/fr/a/8109885/villa-2-%C3%A9tages-manouba,0,540000,la manouba,la manouba,380,8,4,"réf: avm01691perla immo met en vente une villaemplacement: manouba cité de la santébon emplacement cité résidentielleconstituée de 2 étages s4 indépendants.superficie totale: 380 m²superficie couverte: 170*2 m²composition:rez de chaussée: un salon salle à manger, une chambre de séjour, deux chambres à coucher, une suite parentale avec baignoire, une salle de bain et une cuisine bien équipée.a l'étage: un salon salle à manger, une chambre de séjour, deux chambres à coucher, une suite parentale avec baignoire, une salle de bain et une cuisine bien équipée.les 2 niveaux sont séparés offrant une parfaite indépendance entre les espaces.climatiseurs.gaz de ville.jardin de 3 côtésabri pour voitureprix:540000 dt légèrement négociablepapier en règle (titre individuel)contact: 20338278 ou 98617607 ou 71717175.",0,0,0,0,0,0,1,1,0,0,0,1,Non spécifié
https://www.mubawab.tn/fr/a/8159918/villa-elizabelle-%C3%A0-vendre-%C3%A0-carthage,0,1400000,carthage,carthage,120,3,1,"Une villa à rénover sur un terrain de 388m² situé dans un quartier résidentiel très prisé sur les hauteurs de Carthage. A L’entrée, On a un salon, une cuisine, 3 chambres et une salle de bain. A L’extérieur, On a une terrasse et un jardin autour donnant sur la forêt avec la possibilité de faire une terrasse au toit avec une vue sur la colline de Carthage. Pour tous les renseignements, Contacter l’agent sur le 54670670.",0,0,0,0,0,1,1,0,0,0,0,1,Non spécifié
https://www.mubawab.tn/fr/a/8033425/joli-triplex-s4-%C3%A0-gammarth,0,1600000,la marsa,la marsa,270,4,1,"Newkey La Marsa propose à la vente un triplex entièrement neuf, de très haut standing offrant de généreux volumes avec un charmant jardin et une piscine.Il se compose comme suit : Au rez-de-chaussée, vous trouverez un hall d'entrée, un grand salon, une salle d'eau pour les invités et une cuisine moderne entièrement équipée.Au premier étage, vous pourrez profiter d'une salle d'eau avec douche, de deux chambres à coucher ainsi que d'une suite junior.Au deuxième étage, vous découvrirez une suite parentale, un salon avec terrasse ainsi qu'une kitchenette.Un abri pour deux voitures est disponible..  Référence du bien: Ref7208a",0,0,0,0,1,0,1,0,0,0,0,1,Non spécifié
https://www.mubawab.tn/fr/a/8218818/villa-moderne,0,450000,kalâa sghira,Non spécifié,180,3,2,"Une belle Villa Plain-Pied – Cité Manazeh, proche Sahloul à vendrehaut standing, idéalement située à Cité Manazeh le nouveau quartier, à proximité de la route ceinture.Surface terrain : 392 m²Surface bâtie : 180 m²Composition :Salon spacieux et lumineux/3 chambres avec dressings intégrésCuisine équipée/2 salles de bain modernes  une salle d'eau près de la cuisine/Jardin / Espace extérieur/garage pour 2 voitures/Climatisation installée/Possibilité de construire jusqu’à R5Titre bleu disponiblePour plus de détails,voici mon numéro",0,0,0,0,0,0,1,1,1,0,0,0,Non spécifié
https://www.mubawab.tn/fr/a/8159743/duplex-s3-%C3%A0-cit%C3%A9-el-omran,0,370000,monastir ville,monastir ville,168,3,2,"Ce duplex situé à Cité El Omrane, réparti sur trois niveaux, offrant un cadre de vie confortable et fonctionnel.Au rez-de-chaussée, vous trouverez un salon lumineux, une cuisine aménagée, une salle d’eau, ainsi qu’une terrasse.Le premier étage comprend trois chambres bien agencées et une salle de bain familiale.Enfin, le deuxième étage dispose d’une grande terrasse avec un espace barbecue, idéal pour les moments de détente ou les réceptions en plein air.",0,0,0,0,0,0,0,0,0,0,0,1,Non spécifié
https://www.mubawab.tn/fr/a/8183374/duplex-s3-%C3%A0-cit%C3%A9-el-omran,0,382000,monastir ville,monastir ville,132,3,1,"Ce duplex, situé à Cité El Omrane et réparti sur deux niveaux, offre un cadre de vie confortable et fonctionnel.Au rez-de-chaussée, vous trouverez un salon lumineux, une cuisine aménagée, une salle d’eau, ainsi qu’une terrasse.À l’étage, trois chambres bien agencées et une salle de bain familiale complètent l’espace nuit.Un jardin ainsi qu’un abri pour voiture sont également disponibles.",0,0,0,0,0,0,1,0,0,0,0,1,Non spécifié
https://www.mubawab.tn/fr/a/8194901/magnifique-villa-s6-%C3%A0-vendre-%C3%A0-gammarth,0,1850000,la marsa,la marsa,375,6,1,"NewKey La Marsa met à la vente une magnifique Villa s6 à Gammarth .Au rez-de-chaussée , on trouve un salon , salle à manger , un séjour , une cuisine et une salle d'eau pour les invités.A l'étage , y'a Trois suites .Au sous-sol , l'espace se compose d'une salle polyvalente ,salle d'eau et deux chambres .Deux Place de parking sous-sol sont disponibles .  Référence du bien: Ref8268a",0,0,0,1,0,0,0,0,0,0,0,0,Non spécifié
https://www.mubawab.tn/fr/a/8186804/%C3%A0-vendre-%E2%80%93-superbe-villa-s5-%C3%A0-la-marsa-avec-piscine,0,3800000,la marsa,la marsa,876,5,3,"22Estates vous propose à la vente d’une belle villa à fort potentiel, idéalement située à La Marsa, dans un environnement calme et recherché. Édifiée sur un terrain généreux de 876 m² avec une surface bâtie de 370 m², cette propriété rare offre de nombreuses possibilités d’aménagement pour créer une maison familiale de rêve.Dès l’entrée, vous serez accueilli par un vaste jardin paysager et une magnifique piscine entourée d’espaces de détente, parfaits pour les moments en famille ou entre amis.Au rez-de-chaussée on trouve un vaste salon et une salle à manger ouverts sur le jardin et la piscine, un charmant jardin d’hiver, lumineux et agréable, une cuisine indépendante avec accès vers l’extérieur, Une chambre de rangement, une salle d’eau invités avec douche, une chambre à coucher, idéale pour les invités ou une chambre d’appoint.A l’étage on trouve une suite parentale avec dressing et sa salle d’eau privative, de trois chambres à coucher partagent une salle de bain et de deux terrasses offrant une belle vue et de beaux volumes extérieurs.A l’extérieur un grand jardin arboré, une piscine privative, un garage pouvant accueillir jusqu’à 4 véhicules, et de plusieurs espaces de détente en plein air.Cette propriété, rare sur le marché, combine calme absolu, prestations de qualité et proximité de toutes les commodités : écoles, commerces, plages et axes principaux. Pour toutes autres informations, merci de contacter le 27320200.",0,0,0,0,1,1,1,0,1,0,0,1,Non spécifié
https://www.mubawab.tn/fr/a/8134108/duplex-s4-ind%C3%A9pendant-%C3%A0-ksar-sa%C3%AFd,0,360000,le bardo,ksar said,144,4,2,"L'Agence Immobilière JOUINI Montplaisir Vous Propose En Exclusivité Un Charmant Duplex S4 Indépendant Avec Terrasse Et Abri De Voiture À Ksar SaïdDécouvrez Ce Duplex Rare Et Indépendant, Situé Dans Un Quartier Résidentiel Calme, Sécurisé Et Entouré De Villas Et De Duplex, À Ksar Saïd. Profitez D’un Emplacement Privilégié À Proximité Immédiate De Toutes Les Commodités Nécessaires À Votre Quotidien : Mosquée, École Primaire, Collège, Lycée, Banques, Bureaux De Poste…Son Accessibilité Est Un Atout Majeur :À Seulement 5 À 7 Minutes De La ManoubaEntre 10 Et 15 Minutes Du Centre-Ville De TunisAccès Rapide Par La Zone Industrielle De Ksar Saïd Et La Route De Oued Ellil ManoubaLe Bien En Détail :Ce Duplex Indépendant S’étend Sur Deux Niveaux Et Vous Offre :Un Vaste Salon Lumineux, Idéal Pour Vos Moments En FamilleUne Cuisine Américaine Donnant Sur Une Grande Terrasse, Avec Une Buanderie AttenanteUne Salle D’eau Pour Les InvitésQuatre Chambres À Coucher, Dont Une Avec Accès Direct À Une Terrasse PrivéeUne Salle De Bain FonctionnelleUn Abri Pour VoitureConfort Supplémentaire :Chauffage Central InstalléGaz De Ville DisponiblePanneaux Solaires Et Photovoltaïques Déjà Installés, Pour Plus D’économies D’énergieSuperficie Totale : 144 M²Titre Foncier IndividuelPrix Demandé : 360 000 DTContactez-Nous Dès Maintenant Pour Organiser Une Visite .",0,0,0,0,0,0,0,0,1,0,0,1,Non spécifié
https://www.mubawab.tn/fr/a/8249650/maison-plain-pied-sur-2-500-m%C2%B2-%C3%A0-el-medina-jedida,0,3000000,nouvelle medina,nouvelle medina,150,4,2,"Immobilière JOUINI Vous Présente Une Opportunité Rare, Idéale Pour Ceux Qui Cherchent Un Emplacement Stratégique Combinant Espace, Confort Et Potentiel D’aménagement.Cette Propriété Se Compose D’une Maison Plain-Pied Implantée Au Cœur D’un Terrain Spacieux De 2 500 M², Situé Dans Un Quartier Résidentiel Calme, Parfaitement Connecté Et À Seulement Quelques Minutes Des Zones Les Plus Vivantes De Tunis.La Propriété Bénéficie D’un Accès Facile Vers :Le Centre-Ville De Tunis (10 Minutes)L’Avenue Habib BourguibaLes Commerces Essentiels, Services, Écoles Et TransportsUn Emplacement Qui Combine Facilité De Vie, Proximité Et Tranquillité.La Maison Existante, Entièrement Plain-Pied, Offre Un Cadre De Vie Pratique Et Agréable.Mais Son Véritable Atout Réside Dans La Possibilité De Bâtir D’autres Étages, Vous Laissant Libre D’agrandir, Moderniser Ou Transformer Selon Vos Besoins :Extension Verticale PossiblePossibilité D’aménager Une PiscineGrand Jardin Ou Espace VertTerrasses Et Coins Pour Soirées FamilialesCréation D’un Projet Résidentiel Ou FamilialCaractéristiques Essentielles :Superficie Totale : 2 500 M²Titre Foncier IndividuelMaison Plain-Pied ExistantePossibilité De Construire En R1 / R2 (Selon Règlement Local)Terrain Spacieux Offrant Une Grande Liberté D’aménagementPrix Demandé : 1 200 DT / M²Une Propriété Rare Par Sa Superficie, Son Emplacement Et Son Potentiel.Pour Plus D’informations Ou Pour Une Visite Sur Place, Contactez Immobilière JOUINI Montplaisir Avenue De Japon.",0,0,0,0,1,0,1,0,0,0,0,1,Non spécifié
https://www.mubawab.tn/fr/a/8202777/houch-djerbien-avec-terrain,0,420000,midoun,midoune,2214,3,2,"*L'agence immobilière Houch Raycen Immo Met En Vente En exclusivité :Un Terrain de 2214 m² :entouré de palmiers et d'oliviers, offrant une belle harmonie avec la nature,Accompagné d'un magnifique Houch Djerbien de 284 m², en première position sur la route goudronnée.*Situé dans un quartier calme à Midounce bien se compose de :*Deux cuisines*Deux salles de bain*Deux chambres*Une chambre typiquement djerbienne, riche en détails authentiques,*Réservoir d'eau architecture djerbienne*Le Houch est lumineux et dispose d’une sguifa, offrant un cadre de vie agréable en pleine nature.*À proximité des supermarchés, vous serez à seulement 5 minutes du centre-ville et 15 minutes de la mer.* Une belle opportunité à ne pas manquer ! Pour plus d'informations, n'hésitez pas à nous contacter :contact@houch-immo.comFacebook : Houch Raycen ImmoSite Web : www.houch-immo.comTél & WhatsApp : 52 202 616 / 53 202 614",0,0,0,0,0,0,1,0,0,0,0,1,Non spécifié
https://www.mubawab.tn/fr/a/8211966/villa-lagouna-%E2%80%93-saguia-tezdaine,0,620000,tezdaine,Non spécifié,900,3,2,"Villa LAGOUNA – Saguia Tezdaine  À Vendre – Meublée avec Piscine PrivéeLaissez-vous séduire par le charme de cette magnifique villa S3, nichée dans le cadre paisible et recherché de Saguia Tezdaine, à quelques minutes des plages et commodités.Tu as mentionné deux surfaces :•	Surface terrain : 900 m²•	Surface couverte (bâtie) : 220 m²Caractéristiques principales :•	Salon : Un espace de vie spacieux et baigné de lumière naturelle, parfait pour recevoir vos proches ou profiter de moments de détente.•	Chambres : Deux chambres confortables au design épuré, invitant au repos et à la sérénité.•	Suite parentale : Élégante et intime, avec salle de bain privative.•	Cuisine : Moderne, entièrement équipée, pensée pour allier fonctionnalité et esthétisme.•	Salles de bain : Deux salles de bain contemporaines, pratiques et bien agencées.Espace extérieur : un véritable havre de paix•	Piscine privée : Pour des instants de fraîcheur et de plaisir en toute intimité.•	Jacuzzi : Idéal pour vos moments de bien-être et de relaxation.•	Payot : Un coin ombragé pour se ressourcer à l’abri du soleil.•	Jardin paysager : Soigneusement aménagé, verdoyant et agréable.•	Garage privé : Sécurisé et pratique.________________________________________Un bien rare, alliant confort, modernité et douceur de vivre.Prête à accueillir vos plus beaux souvenirs, cette villa n’attend plus que vous !Pour plus d’informations ou pour planifier une visite, contactez-nous via :Email : contact@houch-immo.comTél & WhatsApp : 52 202 616 / 53 202 614Site Web : www.houch-immo.comFacebook : Houch Raycen Immo",0,0,0,0,1,1,1,1,0,0,0,1,Non spécifié
https://www.mubawab.tn/fr/a/8254295/maison-%C3%A0-la-vente-%C3%A0-menzah-9-a,0,1150000,el menzah,el manar 2,480,3,2,Villa menzah 9A rdc  1Quartier residentielTerrain 480 m2Battie 220 m24 cc  sdb communeSuite parentaleGrand garage et jardinStudio s0 renoverPrix fix 1.150.000md,0,0,0,0,0,0,1,0,0,0,0,0,Non spécifié
https://www.mubawab.tn/fr/a/7901012/%C3%A0-vendre-un-triplex-s4-%C3%A0-la-marsa,0,870000,la marsa,cité el khalil,352,4,3,"A vendre un Triplex S4 avec jardin à cité el khalil,  au rez-de-chaussée vous trouverez un salon, séjour, cuisine équipée et une salle d'eau invités, au sous sol vous trouverez une deuxième cuisine, un garage pour 3 voitures et une chambre de service,  à l'étage: une suite parentale avec dressing et salle de douche et 2 chambres avec dressing qui partagent une salle de bain avec cabine de douche. Sur le toit, une chambre à coucher avec dressing et une magnifique terrasse.Superficies: 148m² de terrain.47m² de jardin352m² en bâtiPrix: 870000mdt",0,0,0,0,0,0,1,1,1,0,0,1,Non spécifié
https://www.mubawab.tn/fr/a/8224307/%C3%A0-vendre-maison-inachev%C3%A9e-%C3%A0-hammam-sousse,0,390000,hammam sousse,hammam sousse,380,3,1,"Maison Inachevée à Vendre – Hammam SousseUne opportunité rare à saisir à Hammam Sousse !Nous mettons en vente une maison inachevée située dans un quartier calme et bien desservi, à proximité de toutes les commodités (écoles, commerces, transports…).Surface du terrain : 380m²Surface bâtie : 241m²Nombre de niveaux : RDC avec possibilité d’ajouter deux niveauxPlan prévu : 3 chambres, salon, cuisine, 2 salles de bainTitre foncier individuel : OuiÉtat actuel : en fondations  murs porteurs réalisés / gros œuvre terminéAvantages :Possibilité d’aménager selon vos goûtsQuartier résidentiel recherchéInvestissement idéal pour une résidence principale ou un projet locatifEmplacement : Hammam SoussePrix demandé : 390.000 TNDContactez-nous pour plus d’informations ou pour organiser une visite sur place.Pour plus d’informations ou pour planifier une visite :Téléphone : 216 57 08 02 41 / 54 54 90 54WhatsApp : 216 57 08 02 41 / 54 54 90 54Email : contact@ighimmo.com",0,0,0,0,0,0,0,0,0,0,0,0,Non spécifié
https://www.mubawab.tn/fr/a/8254200/immeuble-a-vendre-ou-a-louer,0,500000,béja,beja nord,398,7,4,À Vendre : Immeuble Mixte avec Fort Potentiel d’InvestissementInclus dans l’immeuble :2 garages (usage commercial)Une maison de style traditionnel au rez-de-chaussée2 appartements S2 à l’étageUn bien idéal pour les investisseurs à la recherche d’un revenu locatif ou d’une propriété polyvalente. Opportunité à ne pas manquer !,0,0,0,0,0,0,0,0,0,0,0,1,Non spécifié
https://www.mubawab.tn/fr/a/8254193/a-vendre-duplex-2s4-%C3%A0-chotrana1,0,850000,la soukra,chotrana 1,238,4,3,"Un duplex 2 Salons3 chambres et une chambre de service situé dans un environnement calme et agréable, dans une résidence R2.Au rez-de-chaussée, vous trouverez deux salons ouvrant directement sur le jardin, une cuisine indépendante spacieuse et entièrement équipée avec four , une chambre de service agencée et une salle d'eau.À l’étage, une suite parentale avec dressing et salle de bain, deux chambres à coucher avec dressing et une salle de bain commune.À l’extérieur, un jardin de 46m2, et un abri pour une voiture.Le duplex est équipé du chauffage central et de la climatisation central.",0,0,0,0,0,0,1,1,1,0,0,1,Non spécifié
https://www.mubawab.tn/fr/a/8254182/vente-maison-et-1-etage,0,450000,el omrane superieur,el omrane supérieur,170,3,1,villa comprend rez de chaussee et 1 etage independant alors le rez de chaussee comprend 3 ch sdb sejour cuisine et 2 salons et 3 cours et un garage espacieux kont a3mlou superette photovoltaique et chauffeaux solaires pour l'etage comprend 3 ch sdb cuisine balcom et chauffeaux solaires louer maintenant a 450d par,0,0,0,0,0,0,0,1,0,0,0,1,Non spécifié
https://www.mubawab.tn/fr/a/8171419/%C3%A0-vendre-2-maisons-plain-pied-%C3%A0-akouda,0,380000,akouda,akouda,430,2,2,Vente de 2 maisons plain-pied à Akouda – Opportunité rare Emplacement : Akouda Superficie terrain : 430 m² Idéal pour habitation familiale ou investissement locatif Maison 1 : Grand salon lumineux avec accès à une terrasse 2 grandes chambres à coucher Cuisine Salle de bain avec douche Option de construction d’un étage supplémentaire (01er étage possible) Maison 2 : Grande terrasse 5 chambres à coucher Salle de bain avec baignoire Cuisine spacieuse Équipements : 2 compteurs STEG 2 compteurs gaz de ville 1 compteur SONEDE Prix : 380 mille dinars,0,0,0,0,0,0,0,0,0,0,0,1,Non spécifié
https://www.mubawab.tn/fr/a/8253849/un-duplex-en-s6-aux-jardins-de-carthage,0,1650000,le kram,les jardins de carthage,250,6,4,"Seven Real Estate vous propose à la vente un duplex en S6 situé au neuvième étage d’une résidence gardée aux Jardins de Carthage. Le bien est composé comme suit :Au premier niveau : un espace de vie avec une terrasse , une cuisine équipée attenante à un séchoir, une chambre de service, une salle d’eau invités ,un séjour, deux chambres à coucher et une suite.A l’étage : un séjour, une suite parentale , deux chambres à coucher et une salle de bain .Le duplex est équipé du chauffage central et de climatiseurs et dispose de deux places de parking au sous-sol.",0,0,0,1,0,1,1,1,1,1,0,1,Non spécifié
https://www.mubawab.tn/fr/a/8244846/a-vendre-triplex-s3-a-gammarth,0,980000,la marsa,gammarth,300,3,1,"By Louati Immo met à votre disposition la vente un triplex de haut standing S3 avec jardin Neuf direct promoteur dans une résidence très agréable et proche de toutes commodités à GAMMARTH .Ie Rdc se compose d’un salon lumineux une cuisine trés bien aménagé et équipée,salle d’eau invitée, une  chambre sejour qui donne acces sur le jardin de 50 m2 et le piscine.A L’etage on trouve une suite parentale avec salle de douche, Deux chambre à coucher avec dressing et une salle de douche. le duplex bénéficie d’une bonne orientation sur le jardinSurface bâti; 240m2Surface jardin;50 m2Remise des clé decembre 2025 .Deux  place parking sous sol privée et une chambre a votre dispositions.",0,0,0,1,1,0,1,0,0,0,0,0,Non spécifié
https://www.mubawab.tn/fr/a/8040061/villa-%C3%A0-vendre-plein-ariana,0,950000,ariana ville,ariana,166,4,2,"à vendre une villa s3 plein pied à Arianacomposition :à l'entrée on trouve : salon avec cheminée , salle à manger , salle d'eau suite parentale et 2chambres à coucher , une cuisine , débarras et toiletteà l'extérieur : garage pour 2 voiture et jardinsuperficie terrain : 870 m²superficie bâti : 166 m²prix : 950 milles au lieu 1.120 MD négociablevotre conseillère en immobilier NASSIMA :  (téléphone / WhatsApp)",0,0,0,0,0,0,1,0,1,0,0,0,Non spécifié
https://www.mubawab.tn/fr/a/8253502/maison-3-%C3%A9tages-%C3%A0-el-mourouj-4,0,450000,el mourouj,el mourouj 4,300,6,3,"A vendre ma maison, surface 100m2 et battu de 300 m2, 3 étages un garage, site à Mourouj 4 prés du centre commercial Challekh et du Terminus Métro.- 1ére étage : entré 1. Compteurs eau et électricité, composé d’un salon 2 chambre S de Bain Cuisine et terrasse avant et arrière.- 2éme et 3éme étage : style américain, autre entré isolé de la première étage et autres Compteurs eau et électricité, composés d’un Salon 4 chambre Toilette S de Bain douche de suite de la chambre à coucher Cuisine avec des terrasses pour chaque pièce, équipé d’une installation de chauffage central ave escalier interne pour l’extérieur.",0,0,0,0,0,0,0,0,1,0,0,1,Non spécifié
https://www.mubawab.tn/fr/a/8252728/a-vendre-rdc-appartement-%C3%A0-ras-jebel,0,290000,ras jebel,Non spécifié,145,6,2,"EDF Immobilière met à la vente à Ras Jebel BizerteMaison au RDC composé ;Salon  2 chambres, SDB, cuisine,  terrasse et garage1er étage un grand Salon  cuisine , 2 chambres  et SDBsuperficie  145m²Titre Foncierprix de vente 290MDPour plus d'information veuillez nous contacter sur le 72497990 /29276359/ 29276849ou visiter notre agence 94 Rue Abou Baker Razi Ras Jebel",0,0,0,0,0,0,0,0,0,0,0,1,Non spécifié
https://www.mubawab.tn/fr/a/8252487/immeuble-gaya-%C3%A0-vendre-%C3%A0-la-marsa,0,700000,la marsa,la marsa,225,6,2,"Immeuble sur un terrain de 225m², situé à Jbal Khaoui, La Marsa. Au RDC, on a un appart S2, 1 ér étage, on a S4, à l'extérieur, on a un terrasse et 4 garage. Contaceter Agent: 56290850.",0,0,0,0,0,0,0,0,0,0,0,1,Non spécifié
https://www.mubawab.tn/fr/a/8189597/vente-villa-de-446-m2-a-menzah-1,0,1300000,el menzah,el menzah 1,300,4,2,ON vous propose a la vente une villa sur 2 niveaux séparésa Elmenzah 1 en bon état  dans un quartier résidentiel  de surface terrain 446 m2 et coouvers de 300 m2 prix 1.3 mdt,0,0,0,0,0,0,0,0,0,0,0,0,Non spécifié
