url,type,price,gouvernorat,delegation,surface_totale,nombre_chambres,nombre_salle_bain,description,etage,neuf,haut_standing,parking,piscine,vue_panoramique,jardin,climatisation,chauffage,ascenseur,balcon,terrasse,area
https://www.mubawab.tn/fr/a/8203166/a-vendre-une-villa-sur-deux-niveaux-a-la-marsa,0,3300000,la marsa,la marsa,400,6,5,Vous cherchez une villa a la marsa saadavotre agence immobilière Arcane vous propose une très belle villa sur deux niveaux et un studio indépendant a la ventevilla moderne  avec un très beau jardinspour avoir plus d'information n'hésiter pas de nous contacter sur 27777462,0,0,0,0,0,0,1,1,1,0,0,1,Non spécifié
https://www.mubawab.tn/fr/a/8202850/superbe-villa-%C3%A0-vendre-%C3%A0-gammarth,0,1850000,la marsa,gammarth,0,4,3,"CLÉ D'OR IMMOBILIER met en Vente :Découvrez cette magnifique villa à vendre à Gammarth, un véritable havre de paix avec piscine et jardin privés.Idéale pour une vie de famille élégante, la villa se compose de deux suites et de deux chambres, offrant confort et intimité pour tous.Cette propriété est une opportunité rare dans l'un des quartiers les plus prisés.Pour plus d'informations ou pour organiser une visite, contactez Clé d'Or Immobilier",0,0,0,0,1,0,1,1,1,0,0,1,Non spécifié
https://www.mubawab.tn/fr/a/8202279/a-vendre-maison-ksour-essef-15-mn-centre-ville,0,90000,ksour essef,Non spécifié,170,2,1,A VENDRE MAISON SITUEE EN RDC PETIT IMMEUBLE DE 170 M2 HABITABLE  50 M2 JARDIN  VERANDA TERRASSESITUE EN HAUTE VILLE DE KSOUR ESSEF A 15 MN A PIED DU CENTRE VILLEPOSSEDE UNE ENTREE PRINCIPALE  SALON  2 CHAMBRES  CUISINE  WC  SALLE DE BAINPRIX : 90000 DINARS TNACHAT POSSIBLE EN LOT CAR MEME PROPRIETAIRE / IDEAL INVESTISSEMENT LOCATIF,0,0,0,0,0,0,1,0,0,0,0,1,Non spécifié
https://www.mubawab.tn/fr/a/8189524/villa-%C3%A0-vendre,0,370000,ksibet el-médiouni,Non spécifié,444,4,1,"Villa de style arabe en position d’angle, avec accès sur voie de 8 mètres. Elle offre une architecture traditionnelle et des espaces bien répartis :Hall d’entréeQuatre chambres spacieusesKitchenette fonctionnelleSalle d’eau indépendanteTerrasse bien exposéeCours intérieurePorte de garageContactez-nous pour plus d’informations ou pour organiser une visite.",0,0,0,0,0,0,1,0,0,0,0,1,Non spécifié
https://www.mubawab.tn/fr/a/8202066/a-c%C3%A9der-une-maison-arabe-en-plein-centre-ville,0,150000,ksar hellal,Non spécifié,130,2,1,"A céder cause partage d'héritage, une maison en plein centre-ville Ksar Hellal (gouvernorat Monastir) une maison arabe prés de tous les services.la maison est composée de 3 pièces, patio, cuisine, toilette et salle de bain.L’endroit est calme et très sécurisé et tous les services sont disponibles ( écoles, hôpital, transport..)une occasion à n'est pas rater.",0,0,0,0,0,0,0,0,0,0,0,0,Non spécifié
https://www.mubawab.tn/fr/a/7915393/a-vendre-une-villa-situ%C3%A9e-au-bardo,0,690000000,le bardo,le bardo,400,7,3,- Rez-de-chaussée- superficie bâtit: 150 m²- S3 avec abri de voiture plus un garage-- Duplex- superficie bâtit: 260 m²- S4 avec dressing  une suite parentale,0,0,0,0,0,0,1,0,1,0,0,1,Non spécifié
https://www.mubawab.tn/fr/a/8201900/villa-inachev%C3%A9e-vue-panoramique-sur-mer,0,350000,soliman,Non spécifié,292,3,2,"Je mets en vente un terrain avec villa inachevée dans la région de Nabeul, a Soliman Jahmi. Ci-dessous les informations les plus importantes :- Titre bleu disponible- surface du terrain : 292 m2- Terrain qui fait l’angle avec une vue panoramique sur la plage Jahmi.- Pas de construction possible dans les terrains d’en face- Actuellement : le RDC coulé fait 110m2, et le R1 fait 70m2, avec une terrasse vue sur mer de 40m2, ainsi qu un garage de 24 m2 (6 x 4m)- Possibilité de monter jusqu’au R2- Travaux pour piscine (environ 40m2) entamés- Trois chambres, deux salles de bains et une cuisine.- Les fondations et l’ensemble de la structure ont été montés, il ne manque que la dalle haute du R1- Compteur eau et compteur électricité Force disponibles- Ci-joint les photos du terrain et les travaux entamés, ainsi que des 3D de ce qui était prévu à l’origine.À noter que le quartier est très calme avec des voies de circulation neuves.",0,0,0,0,1,1,1,0,0,0,0,1,Non spécifié
https://www.mubawab.tn/fr/a/8187945/villa-individuelle-en-vente,0,360000,ksibet el-médiouni,Non spécifié,397,2,1,"À vendre : Villa indépendante de 397 m² avec garage – S2Une villa de plain-pied d’une superficie totale de 397 m², idéale pour une résidence principale ou un investissement.Composition :Un salon spacieux et lumineuxDeux chambres à coucherUne cuisine indépendanteUne salle de bain et un toilette séparéUn garage privéPour plus d’informations ou pour planifier une visite, veuillez nous contacter.",0,0,0,0,0,0,1,0,0,0,0,0,Non spécifié
https://www.mubawab.tn/fr/a/8200700/maison-%C3%A0-vendre-bousalem,0,135000,bou salem,Non spécifié,120,4,2,"Maison sur deux étages.4 chambres.Chaque étage est composé de deux chambres, 1 salle d'eau, une cuisine et un séjour.Le RDC comprend une cours intérieure.Vous pouvez me contacter sur wattsapp au",0,0,0,0,0,0,0,0,0,0,0,0,Non spécifié
https://www.mubawab.tn/fr/a/8194867/maison-a-r%C3%A9nover-alain-savary-802m2,0,2000000,tunis,montplaisir,802,3,2,"Occasion à saisir pour cette maison à vendre. Prix 2 000 000 TND. 3 chambres, 2 salles de bains, 802 m². Bon état.Cette belle maison est en vente à Montplaisir, Tunis.",0,0,0,0,0,0,0,0,0,0,0,0,Non spécifié
https://www.mubawab.tn/fr/a/8138288/kasr-essa%C3%AFd-vente-d-une-maison-neuve-jamais-habit%C3%A9,0,530000,le bardo,ksar said,210,6,2,"On  vous propose à la vente  à kssar Essaïd une  maison composé de deux appartements S2  neufs indépendants, jamais habité.•	RDC         : Salon,  2 chambres, cuisine, SDB.•	1ère Etage : Salon,  2 chambres, cuisine, SDB.Terrain : 202 m2, couvert 210 m2 (100 & 110), Titre individuelLes deux appartements sont dans un très bon standing.quartier calme, et composé de villas seulementlavilla se trouve près de carrefour, et du stade de Bardo,Pour tout renseignement veillez contacter le conseiller en immobilier Mr Ketata chafik  au Tél :",0,0,0,0,0,0,0,0,0,0,0,0,Non spécifié
https://www.mubawab.tn/fr/a/7937856/a-vendre-villa-d-un-seul-%C3%A9tage-%C3%A0-lakagnia-el-ouardia,0,520000,el ouardia,lakanya,575,4,1,VECTEUR IMMO propose à la vente une villa dans un quartier résidentiel très calme à El Ouardia 1 Emplacement   Lakagnia     Superficie  575m2    Bâtit  115 m2 à rénover    Typologie villa à un seul étage    Artère  secondaire Composée d’un salon 2 pièces cuisine salle de bain     Salle de bain commune Commodités      Grand Garage      Jardin spacieux PRIX 520 000 TND TITRE FONCIER CONTACT   HABA MAHER,0,0,0,0,0,0,1,0,0,0,0,0,Non spécifié
https://www.mubawab.tn/fr/a/8200058/maison-arabe-avec-%C3%A9tage-et-local-commercial,0,205000,tunis,el halfaouine,187,4,2,il s'agit d'une maison composée d'un rdc de 120m2 (3 chambres cuisine salle de bain) avec un étage de 60m2 (chambre salon cuisine salle d'eau terrasse) et un local commercial de 7m2 soit une surface totale de 187m2. le tout sur un terrain de 132m2.aucune pathologie grave. rénovation nécessaire.,0,0,0,0,0,0,0,0,0,0,0,1,Non spécifié
https://www.mubawab.tn/fr/a/8162571/un-duplex-s3,0,860000,la soukra,chotrana 1,190,3,3,"Ds Reality met à votre disposition à la vente un duplex S3 d’une superficie 190m2 bâti et 35 m2 jardin dans une résidence R2 à la soukra Chotrana 1 , il se compose :*Rez-de-chaussée :- Un spacieux salon salle à manger ouvrant à un espace de jardin-Une cuisine équipée par plaque hotte four-Une salle d’eau d’invitéPartie nuit:-Une suite parentale avec dressing-Deux chambres à coucher l’un avec balcon-Une salle de bain commune-La climatisation split et chauffage central-Deux place de parking sous-sol",0,0,0,1,0,0,1,1,1,1,1,1,Non spécifié
https://www.mubawab.tn/fr/a/8199128/a-saisir-belle-villa-bardo-centre,0,1234570,le bardo,le bardo,550,7,3,Belle Villa tres bien situéeR2 composée de quatre appartements02 jardins privatifsQuartier calme et propreIdéale pour projet résidence de haut standingSituation foncière en règle,0,0,0,0,0,0,1,1,0,0,0,1,Non spécifié
https://www.mubawab.tn/fr/a/8199294/a-vendre-terrain-de-470m%C2%B2-%C3%A0-av-alain-savary,0,1250000,cité el khadra,cité jardins,260,5,2,"Remax VÏP Vous propose à la vente Terrain de 470m² avec Bâtisse sur deux niveaux à létat brut : murs démolis ou manquants, structure porteuse stable permettant une réhabilitation complète ou à démolir.Sis à Rue Mouaouia Ibn Abi Sofian (Quartier Alain Savary)Données de base:Surface terrain : 470m²Bâtisse existante : 260m² (structure porteuse intacte, non habitable en létat)COS  (Coefficient d'occupation du Sol) : 0.35 Surface au sol max  470  0,35  164,5 m²CUF (Coefficient d'utilisation du Sol) : 1 Surface totale construite max  470  1  470 m²Vocation urbanistique : R plus 2 (rez-de-chaussée  2 étages)Zone en requalification à usage professionnel.Pour plus d'informations veuillez nous contacter au 99 10 09 04 ou par WhatsApp.",0,0,0,0,0,0,1,0,0,0,0,1,Non spécifié
https://www.mubawab.tn/fr/a/8154455/%C3%A0-vendre-%C3%A9tage-de-villa-%C3%A0-tantana-kantawi,0,430000,tantana,Non spécifié,180,4,2,À Vendre étage de Villa S4 à Tantana kantawiCôté merSuperficie 180 m2GarageEntrée indépendanteTitre individuelPour plus d'informations contactez nous98 111 589/ 54 366 962WhatsApp00216 98 111 58900216 54 366 962,0,0,0,0,0,0,0,1,1,0,0,1,Non spécifié
https://www.mubawab.tn/fr/a/8198922/vente-maison-%C3%A0-cit%C3%A9-ezzitoun-1-surface-de-189-m%C2%B2-jardin-et-garage,0,260000,fouchana,cité ezzitoun 1,189,6,2,"Très belle propriété à vendre.Prix 260 000 TND.6 chambres, 2 salles de bains, 189 m².Nouveau.Revêtement: Parquet.Résidence équipée de places de parking.Vous profiterez également d'un beau jardin.Venez découvrir cette maison à vendre à Cité Ezzitoun 1, Fouchana.",0,0,0,1,0,0,1,0,0,0,0,0,Non spécifié
https://www.mubawab.tn/fr/a/8198787/maison-en-train-de-construire,0,12345,mornaguia,mornaguia,180,3,2,Une bon affaire avec un prix raisonable,0,0,0,0,0,0,1,0,0,0,0,0,Non spécifié
https://www.mubawab.tn/fr/a/8089288/un-duplex-s3,0,1300000,le kram,les jardins de carthage,292,3,3,"Ds Reality met à votre disposition à la vente un Driplex S3  side 292 m2 avec jardin de 100 m2 à jardin de Carthage dans une résidence sécurisée , il se compose :* partie jour :* -un grand salon salle à manger avec dressing à l’entrée* Une cuisine équipée par plaque hotte et four avec séchoir et chambre de service et qui ouvre aussi au jardin* - salle d’eau d’invité* Partie nuit :* Suite parentale avec dressing et un spacieux terrasse sur les trois chambres* 2 chambres à couché avec dressing* Salle de bain commune* Boxe de voiture  aux sous-sol avec 2 cellier* Climatisation central et chauffage central",0,0,0,0,0,0,1,1,1,1,0,1,Non spécifié
https://www.mubawab.tn/fr/a/8186253/un-%C3%A9tage-du-maison,0,280000,le kram,erriadh,104,3,1,"Un étage du maison situé au Kram, en Avenue Mohamed 5 plus précisement, auprés de la Foire du Kram et 10 min. de Tunisia Mall. Il dispose d'un salon, une cuisine, une salle de bain et 3 chambres, ainsi que 2 balcons. Avec possibilité de construire aux troisième étage. Prix : 280 000 TND",0,0,0,0,0,0,0,0,0,0,1,0,Non spécifié
https://www.mubawab.tn/fr/a/8141385/immeuble-d%E2%80%99angle-%C3%A0-mornaguia-centre-ville,0,550000,mornaguia,mornaguia,300,7,3,"En Exclusivité Agence Immobilière JOUINI Montplaisir Vous Propose Ce Bien Exceptionnel À Découvrir Sans Tarder Cet  Immeuble D’angle Exceptionnel À Mornaguia Centre-Ville Idéal Pour Investissement Locatif Ou Habitation Double Usage À La Croisée Des Grandes Routes : À Deux Pas De Bardo, La Kasbah, Avenue 9 Avril, Et Facilement Accessible Depuis Tunis Centre, Les Mouroujs, La Route X, Tout En Profitant D’un Quartier Animé, Entouré De Commerces, Écoles, Et Services Administratifs. Ce Grand Immeuble D’angle, À Double Façade, Offre Une Accessibilité Optimale Et Une Visibilité Parfaite Pour Vos Projets Résidentiels Et Commerciaux. Il Allie Confort, Fonctionnalité, Et Potentiel De Rendement Locatif.Composition De L’immeuble :Surface Terrain : 190 M²Surface Bâtie : 300 M²Chauffage Central Installé Dans Toute La PropriétéAbri Voiture Pour 2 VéhiculesMaison Au Rez-De-Chaussée (S3) :Hall D’entrée Avec Rangements IntégrésSalon LumineuxSéjour ConfortableChambre À Coucher SpacieuseCuisine Ouvrant Sur Une Terrasse EnsoleilléeSalle De Bain IndépendanteMaison À L'étage (S4) :Hall D’entrée AccueillantGrand Salon  SéjourQuatre Chambres À Coucher Bien AgencéesSalle D’eauSalle De Bain Familiale3 Locaux Commerciaux Au Rez-De-Chaussée :Emplacements Stratégiques Sur Une Rue PassanteIdéals Pour Bureaux, Commerces, Ou Activités LibéralesAccès IndépendantPrix Demandé : 550 000 DTContactez IMMOBILIÈRE JOUINI Dès Maintenant Pour Organiser Une Visite Et Découvrir Tout Le Potentiel De Cet Immeuble Rare .",0,0,0,0,0,0,0,0,1,0,0,1,Non spécifié
https://www.mubawab.tn/fr/a/7978346/maison-%C3%A0-vendre-3-%C3%A9tages-ind%C3%A9pendants,0,240000,fouchana,cité el amel 2,100,3,2,"Je vous propose une maison composée de trois étages indépendants :- **Rez-de-chaussée (S1)**- **Premier étage (S2)** : Un appartement lumineux avec deux chambres, idéal pour une famille.- **Deuxième étage** : Un espace en cours de finition, offrant la possibilité de le personnaliser selon vos besoins.2 ème étage S2 en phase de constructionCette maison est une opportunité unique.",0,0,0,0,0,0,0,0,0,0,0,1,Non spécifié
https://www.mubawab.tn/fr/a/8197122/3-%C3%A9tage-s3,0,400000,le kram,le kram,213,3,1,"Venez visiter cette belle maison à vendre.Prix 400 000 TND.3 chambres, 1 salle de bains, superficie 213 m².3 pièces.Moins de 10 ans.Chauffage central.Venez découvrir cette maison à vendre à Le Kram, Le Kram.",0,0,0,0,0,0,0,0,1,0,0,0,Non spécifié
https://www.mubawab.tn/fr/a/8196674/lot-maisons-raoued-a-300m-de-la-mer,0,450000,raoued,cité des juges,350,2,1,"JE VENDS DANS LE SECTEUR DE RAOUED À 300 M DE LA MER ET À MOINS DE 1KM DU PROJET MARINA, 3 MAISONS MITOYENNES SUR UN TERRAIN TOTAL DE 500M2 : 2 MAISONS SUR TERRAIN DE 150M2 CHACUNE (salon, cuisine, deux chambres, sdb, terrasses devant et derrière), À RÉNOVER. PLUS UNE 3e MAISON RÉCENTE SUR UN TERRAIN DE 200M2 (salon, cuisine, deux chambres, sdb, terrasse, jardinet).LE LOT DES 3 MAISONS 450 000 DT. PRIX LÉGÈREMENT NÉGOCIABLE MAIS RAISONNABLE. POSSIBILITÉ DE VENDRE LES MAISONS SÉPARÉMENT.PAS SÉRIEUX S’ABSTENIR. MERCI.",0,0,0,0,0,1,1,0,0,0,0,1,Non spécifié
https://www.mubawab.tn/fr/a/8013023/villa-la-rose,0,756000,hammamet,hammamet sud,420,4,4,"À vendre chez Green Immobilier une demeure bien située à Hammamet côté sudElle s’étend sur un terrain de 420 m² avec une superficie habitable de 270 m².elle offre:- un salon salle à manger- une cuisine bien aménagée- une suite : une salle de bain, dressing- 3 chambres à coucher- un jardin- piscine- Terrasse- coin barbecue- place de parkingLa villa est équipée d'un chauffage central etde climatisation installée prèsPrix demandé : 756.000 MDT",0,0,0,1,1,0,1,1,1,0,0,1,Non spécifié
https://www.mubawab.tn/fr/a/8196539/villa-style-am%C3%A9ricain-%C3%A0-vendre-%C3%A0-el-mourouj-3,0,480000,el mourouj,el mourouj 3,180,5,2,"Bonjour,Je mets en vente une villa située à El Mourouj 3.Celle si est composée :Au RDC : Salon  Salle à Manger  Cuisine  salle d'eau  une piece à vivre ou chambre selon utilisation.Au 1er étage : salon (avec petit balcon)  4 chambres dont une avec balcon  salle d'eau.Dernier étage : accès au toit où se trouve une très grande pièce.La maison possède aussi une deuxième cuisine externe  un espace pour garer une petite voiture  un petit véranda et un séchoir à l'arrière.N'hésitez pas à nous appeler pour tout renseignement sur le.",0,0,0,0,0,0,0,0,0,0,1,1,Non spécifié
https://www.mubawab.tn/fr/a/8047925/a-vendre-villa-de-485-m%C2%B2-sur-un-terrain-de-400-m%C2%B2,0,650000,hammam chatt,hammam chatt,485,6,3,"Située sur une artère principale prisée, cette villa à deux niveaux offre un fort potentiel pour devenir la résidence de vos rêves. D'une superficie généreuse de 485 m², cette maison nécessite quelques travaux de rénovation pour exprimer tout son charme.Offrant une belle distribution des espaces avec plusieurs chambres, un séjour lumineux, ainsi que des espaces de vie à personnaliser selon vos goûts.elle est située sur une artère principale à proximité de commerces et transport en commun, tout en conservant une certaine intimité.Elle se distingue par ses deux escaliers un à l'intérieur et un extérieur, permettant de séparer ou relier les deux niveaux selon vos besoins. L'escalier intérieur permet de circuler facilement entre les deux niveaux, tandis que l'escalier extérieur donne la possibilité de créer une séparation complète, offrant ainsi une flexibilité pour deux logements indépendants.Un studio indépendant de 35 m² parfait pour accueillir des invités, en faire un espace de travail, ou encore le mettre en location pour un revenu complémentaire.Elle dispose d'un usage mixte ce qui permet d'y développer un projet résidentiel et commercial. cette propriété offre une flexibilité unique pour séparer les deux étages et en faire des espaces distincts. Idéal pour diverses utilisations.",0,0,0,0,0,0,1,1,1,0,0,1,Non spécifié
https://www.mubawab.tn/fr/a/8196212/fort-potentiel-comercial-m%C3%A9dina-tun-z-touristique,0,430000,la medina,Non spécifié,310,2,1,"Bien rare, idéal pour projet café-restaurant ou commerce haut de gamme, dans l’un des emplacements les plus prisés du circuit touristique.130 m² au sol (2 makhzen : 90 m²  20 m²)Étage de 170 m² à reconstruire entièrementPossibilité de bâtir 2 étages supplémentairesDouble façade : une rue et une impasseVue rooftop exceptionnelle (cf. photo jointe)Plan d’architecte  business plan dispoCurieux s’abstenir – investisseurs sérieux uniquement",0,0,0,0,0,1,0,0,0,0,0,1,Non spécifié
https://www.mubawab.tn/fr/a/8195695/maison-%C3%A0-2-niveux,0,290000,tunis,abou el kacem chebbi,100,2,2,"Une maison indépendante à vendre composée de 2 logements avec  terrasse à cité intileka à deux pas du jardin d’el menzahaccès facile via la route x20 et route de bizerte, à seulement 10 min de cité ennaser 1 & 2 !vous cherchez  un investissement familial intelligent ? ne cherchez plus ! cette maison indépendante bâtie sur un terrain de 100 m² est une véritable opportunité rare.parfait aussi pour une famille, ou ceux qui cherchent à acheter pour habiter et louer en parallèle.emplacement stratégique près de toutes commodité (école, marché, poste, station métro 5).prix négociable aux intéressés.prix demandé : 290.000 dt",0,0,0,0,0,0,1,0,0,0,0,1,Non spécifié
https://www.mubawab.tn/fr/a/8194206/a-v-vaste-villa-de-560-m2,0,1480000,la goulette,la goulette,450,14,4,A vendre vaste villa de 560m2 dans un quartier résidentiel kheireddine plage dotée de 2 étages indépendants. Au rez-de-chaussez: 5 pièces salon salle de bain salle à manger kitchenette bien équipée un vaste jardin toute autour. 1ere étage: la meme composition. 2 studios s2 (destinés à la location) RDV que pour les sérieux. Prix à discuter,0,0,0,0,0,0,1,0,1,0,0,1,Non spécifié
https://www.mubawab.tn/fr/a/8194177/a-vendre-appartement-a-mourouj-5,0,125000,el mourouj,el mourouj 5,82,2,1,"A vendre appartement  en 2 ème étage en bon état sis à mourouj 5 proche de toutes les commodités. il est composé d'un salon salle à manger  2 chambres à coucher, cuisine, salle de bain, balcon, séchoir. Titre foncier individuel.",0,0,0,0,0,0,0,0,0,0,1,1,Non spécifié
https://www.mubawab.tn/fr/a/8194146/maison-%C3%A0-vendre-%C3%A0-wardia-4-%E2%80%93-tunis,0,190000,el kabaria,el ouardia 4,100,4,2,"Située dans un quartier calme, résidentiel et avec un bon voisinage. Emplacement idéal, proche de toutes les commodités.La maison est composée de deux étages totalement indépendants, chacun avec son propre accès :1er étage :1 salon2 grandes chambres1 salle de bain1 cuisineUn patio (WEST DAR)2ème étage :1 salon2 grandes chambres1 salle de bain1 cuisineAtouts de l'emplacement :À 5 minutes à pied du marché municipalEntourée de 3 stations de métro (5 minutes à pied chacune)À proximité de 2 magasins AzizaCarrefour Market à seulement 10 minutes à piedAccès facile à tous les services : transports, commerces, écoles, pharmacies, etc.Une maison idéale pour vivre ou pour investir. Ne ratez pas cette opportunité ! Titre foncier individuel, papiers en règle, éligible à un financement bancaire.",0,0,0,0,0,0,0,0,0,0,0,0,Non spécifié
https://www.mubawab.tn/fr/a/8110325/a-vendre-villa-jumel%C3%A9e-%C3%A0-soukra-chotrana-3,0,850000,la soukra,chotrana 3,400,3,3,"Agence Darcom Tunisia vous propose à la vente une villa jumelée ayant une superficie bâtie de 400 m² située dans un bon emplacement à Chotrana 3 la Soukra.La villa est répartie sur trois niveaux .Rez de chausséé  composé d’un salon ,salle à manger avec Terrasse donnat sur le jardin, une cuisine aménagée et équipée (Hotte, Plaque et Four) et une salle d’eau pour invités ainsi qu’un abris pour  deux voitures.L'étage est consacré pour la partie nuit qui comprend une suite parentale et deux chambres à coucher qui se partagent une salle de bain.2 Coquette studio en deuxiéme étageLa villa est équipée d’un système central de climatisation et chauffage.N’hésitez pas à contacter nos conseillers pour un rendez-vous.",0,0,0,0,0,0,1,1,1,0,0,1,Non spécifié
https://www.mubawab.tn/fr/a/8193860/%C3%A0-vendre-maison-%C3%A0-sousse,0,370000,sousse ville,sousse ville,165,4,2,À Vendre Maison de superficie 165 m2RDC Garage1 ère étage S3Titre bleuPour plus d'informations contactez nous98 111 589  / 54 366 962WhatsApp00216 98 111 58900216 54 366 962,0,0,0,0,0,0,0,0,0,0,0,0,Non spécifié
https://www.mubawab.tn/fr/a/8146607/%C3%A0-vendre-%E2%80%93-immeuble-r3-en-cours-de-finition,0,690000,boumhel bassatine,bou mhel,560,12,8,"À vendre un immeuble en R3 situé à Boumhal Basatine, dans une zone en pleine extension, à seulement 5 minutes à pied de Carrefour Boumhal et à proximité de toutes les commodités.Caractéristiques principales :•	Superficie du terrain : 200 m²•	Surface bâtie totale : 560 m² sur 3 niveaux•	Chaque étage est composé d’un S3 spacieux•	Immeuble en cours de finition•	Dossier juridique en règle – titre individuel disponibleEmplacement stratégique, idéal pour un investissement locatif ou un projet familial.Fort potentiel locatif :Le loyer moyen dans la zone est estimé entre 1 100 DT et 1 300 DT pour des biens de standing moyen, et peut atteindre jusqu’à 1 600 DT pour des logements haut standing.Pour plus d’informations ou pour organiser une visite, veuillez me contacter.",0,0,0,0,0,1,1,0,0,0,0,1,Non spécifié
https://www.mubawab.tn/fr/a/8193330/rare-opportunit%C3%A9-double-maisons-avec-acc%C3%A9s-s%C3%A9par%C3%A9,0,360000,mornag,zaouit mornag,110,4,3,"À vendre : propriété composée de deux maisons S2 indépendantes avec entrées séparées, garage et studioRare opportunité à saisir ! Cette propriété unique se compose de deux maisons superposées, chacune avec sa propre entrée, située dans un quartier résidentiel propre, calme et familial, à seulement quelques pas de la rue principale.Chaque maison est de type S2, comprenant :* Un salon spacieux,* Deux chambres à coucher,* Une cuisine fonctionnelle,* Une salle de bain.Au rez-de-chaussée, vous bénéficiez également d’un garage privé pour voiture. Au deuxième étage, un espace supplémentaire a été aménagé : une pièce indépendante avec salle de bain, idéale comme studio privé, bureau ou penthouse.Cette propriété est idéale pour : * Une grande famille, * Deux foyers souhaitant vivre côte à côte, * Ou un investissement locatif rentable.- Près de Aziza et Azur City.-Proche de toutes les commodités et parfaitement desservie.",0,0,0,0,0,0,0,0,0,0,0,1,Non spécifié
https://www.mubawab.tn/fr/a/8193007/duplexe-%C3%A0-proximit%C3%A9-de-la-zone-touristique,0,350000,mahdia,Non spécifié,180,4,2,Duplexe en face de la cité universitaireet à proximité de la zone touristiques,0,0,0,0,0,0,0,0,0,0,0,1,Non spécifié
https://www.mubawab.tn/fr/a/8192987/a-vendre-maison-ind%C3%A9pendant-sur-trois-niveaux-%C3%A0-bo,0,160000,sousse ville,bouhssina,120,6,1,"IGH immobiliere met à votre disposition une spacieuse maison familiale sur 3 niveaux, située dans un quartier calme à Bohsina SousseCaractéristiques principales :Superficie généreuse répartie sur trois étagesChaque étage dispose d’un espace de vie lumineux et bien agencéCuisine spacieuse (non équipée)Plusieurs chambres à coucher avec une belle luminosité naturelleUn petit jardin et un balconSalle de douche à chaque niveauIdéale pour une grande famille ou un projet d’investissement locatifEmplacement stratégique proche des commerces, écoles, et transportsPour plus d’informations ou pour organiser une visite, n’hésitez pas à nous contacter sur 54549054, 51005426, 51019324",0,0,0,0,0,0,1,0,0,0,1,1,Non spécifié
